mataṅgaśāpādavalepamūlādavāptavānasmi mataṅgajatvam / avaihi gandharvapatestanūjaṃ priyaṃvadaṃ māṃ priyadarśanasya // Ragh(K)_5.53 //	the eloquent one (thus) spoke, enhancing with the lustre of his teeth the (brightness of the ) necklace of large pearls pendant on his bosom. I was reduced to the state of an elephant by the curse of Matanga, incurred by my own arrogance. Know me to be Priyamvada, the son of Priyadars ana, king of the Gandharvas.
sa cānunītaḥ praṇatena paścānmayā maharṣirmṛdutāmagacchat / uṣṇatvamagnyātapasamprayogācchaityaṃ hi yatsā prakṛtirjalasya // Ragh(K)_5.54 //	The great sage, however, being supplicated by me falling at his feet, relented afterwards; for the hotness of water is due to its contact with fire or solar heat; what is coldness is but the nature (natural property) of water.
ikṣvākuvaṃśaprabhavo yadā te bhetsyatyajaḥ kumbhamayomukhena / saṃyokṣyase svena punarmahimnā tadetyavocatsa taponidhirmām // Ragh(K)_5.55 //	"When Aja, sprung from the family of Ikshvàku, will split thy frontal globe with his iron-pointed shaft, then shalt thou be united with (restored to) thy magnificent form "-so spoke that repository of penance (the great sage) to me. I have been liberated from the curse by you endowed with might, whose sight had long been earnestly wished for by me.
pratikriyāṃ cedbhavato na kuryāṃ vyarthā hi me syātsvapadopalabdhiḥ // Ragh(K)_5.56 //	If I do you no good in return, my restoration to my proper position is all to no purpose.
gāndharvamastraṃ taditaḥ pratīccha prayogasaṃhāravibhaktamantram / prasvāpanaṃ nāma yataḥ praharturna cārihiṃsā vijayaśca haste // Ragh(K)_5.57 //	Accept, therefore, O friend, this missile of mine, 'Sammo- hana (the stupifier)' by name, which has a Gandharva for its presiding deity, and has separate incantations for its discharge and withdrawal whereby the discharger has victory in his hand (sure in his possession) and yet has not to kill enemies.
alaṃ hriyā māṃ prati yanmuhūrtaṃ dayāparo 'bhūḥ praharannapi tvam /	You should not be ashamed; for, though striking me, you were moved (for a moment) with compassion; let not the rudeness of a refusal be shown to me who am beseeching you.
tathetyupaspṛśya payaḥ pavitraṃ somodbhavāyāḥ sarito nṛsomaḥ / udaṅmukhaḥ so 'stravidastramantraṃ jagrāha tasmādvigṛhītaśāsī // Ragh(K)_5.59 //	With the words 'Be it so' the eminent (lit. the moon among men) prince, skilled in the use of weapons, having sipped the holy water of the river sprung from Soma (Narmadâ) and turned his face towards the north, received (learned) the incantations of ( connected with the missile from him who was freed from the curse.
eko yayau caitrarathapradeśānsaurājyaramyānaparo vidarbhān // Ragh(K)_5.60 //	Of them two, who, by a strange chance, had thus formed on the way, a friendship (originating) from some unknown cause, one went to the regions of Chaitraratha and the other to the country of Vidarbha delightful on account of the good govern- ment (it enjoyed ).
pratyujjagāma krathakaiśikendraścandraṃ pravṛddhormirivormimālī // Ragh(K)_5.61 //	The lord of the Krathakais'ikas filled with ecstatic joy went forth to receive him who had halted in the vicinity of theCanto V. ] ( 41 ) city, as the ocean with its swelling waves goes forth to receive the moon.
praveśya cainaṃ puramagrayāyī nīcaistathopācaradarpitaśrīḥ /	Walking in the front he led him into the city, and having presented to him his wealth, waited upon (ministered to) him with humility.
mene yathā tatra janaḥ sameto vaidarbhamāgantumajaṃ gṛheśam // Ragh(K)_5.62 //	in such a way that the people assembled there con- sidered Aja to be the host (lit. the lord of the palace) and the king of the Vidarbhas to be the guest.
ramyāṃ raghupratinidhiḥ sa navopakāryāṃ bālyātparāmiva daśāṃ madano 'dhitasthau // Ragh(K)_5.63 // tatra svayaṃvarasamāhṛtarājalokaṃ kanyālalāma kamanīyamajasya lipsoḥ / bhāvāvabodhakaluṣā dayiteva rātrau nidrā cireṇa nayanābhimukhī babhūva // Ragh(K)_5.64 //	He, the representative of Raghu, occupied the delightful new pavilion into which he was shown by the officers of king Bhoja, bending low (before him), and in which vessels filled with water were placed on a dais near its eastern entrance, as Madana (Cupid) occupies the state (age) next to childhood. There, like a loved spouse unable to read (understand) the feelings (of her husband), (or, clouded-displeased by her divination of the mental attitude-affection for a rival), Sleep came late at night towards the eyes of Aja, longing to win the captivat- ing gem of a damsel, by whom a host of kings was caused to be assembled at her self-choice-marriage.
taṃ karṇabhūṣaṇanipīḍitapīvarāṃsaṃ śayyottaracchadavimardakṛśāṅgarāgam / vaitālikā lalitabandhamanoharābhiḥ prābodhayannuṣasi vāgbhiruṣarbudhābham // Ragh(K)_5.65 //	At dawn, the sons of bards, of equal age (with Aja), and eloquent in speech, awakened, with their panegyrical songs, him, of reputed scholarship, whose stout shoulders were pressed by his ear-ornaments and the sweet unguents applied to whose body were almost effaced by his rollings on the bed-sheet.
rātrirgatā matimatāṃ vara muñca śayyāṃ dhātrā dvidhaiva jagato nanu dhūrvibhaktā /	"O you, best of talented men, the night is gone; quit your bed; surely the burden of the world has been divided into two parts only, by the Creator: your vigilant father bears it at one end and your.
yāmekatastava bibharti gururvitandrīryasyā bhavānaparadhuryapadāvalambī // Ragh(K)_5.66 //	honour is the supporter of the other (lit. that borne by the other bearer).
nidrāvaśena bhavatā hyanavekṣyamāṇā paryutsukatvamabalā niśi khaṇḍiteva / lakṣmīrvinodayati yena digantalambī so 'pi tvadānanarucaṃ vijahāti candraḥ // Ragh(K)_5.67 //	The moon by (looking at) whom the goddess of beauty (Lakshmi) was diverting herself at night, like a woman offended by her husband, (somehow) disregarding even her longing for you under the influence of sleep ;-he, too, now resting on the extremity of the western horizon, is giving up (losing) the splendour of your face. [Or, with the reading , (see notes): -The moon by (looking at ) whom the goddess of beauty, though neglected by you under the influence of sleep, was, like a woman offended by her husband, beguiling her love-longing, even he &c.] 68.
tadvalgunā yugapadunmiṣitena tāvat sadyaḥ parasparatulāmadhirohatāṃ dve /	Let, therefore, the two, by their beautiful simultaneous unfolding, obtain mutual similitude: viz.
praspandamānaparuṣetaratāramantaścakṣustava pracalitabhramaraṃ ca padmam // Ragh(K)_5.68 //	your eye with the(42) [ Canto V. lively (lit. other than rough) pupil rolling about within and the lotus with a black bee moving inside.
vṛntaślathaṃ harati puṣpamanokahānāṃ saṃsṛjyate sarasijairaruṇāṃśubhinnaiḥ / svābhāvikaṃ paraguṇena vibhātavātaḥ saugandhyamīpsuriva te mukhamārutasya // Ragh(K)_5.69 // tāmrodareṣu patitaṃ drumapallaveṣu nirdhautahāragulikāviṣadaṃ himāmbhaḥ /	The morning breeze, as if desirous of obtaining, by means of borrowed properties, the natural fragrance of the breath of your mouth, bears away the loosened flowers of trees from their stalks and comes in contact with lotuses opened by the rays of the morning sun (Aruņa). The dew-drops, white like the well-cleansed pearls of a necklace, fallen on the tender leaves of trees with their interiors red, resemble, on account of the position of advantage thus gained by them (or their increased excellence), your sportive smile fallen on your lip, brightened by the splendour of your teeth.
āyodhanāgrasaratāṃ tvayi vīra yāte kiṃ vā ripūṃstava guruḥ svayamucchinatti // Ragh(K)_5.71 //	While the sun, the store of radiant heat, does not rise, even before that, darkness has been, all at once, dispelled by Aruna; when, O hero, you have taken the lead in battles, will (why should) your sire himself extirpate the foes? 72.
śayyāṃ jahatyubhayapakṣavinītanidrāḥ senāgajā mukharaśṛṅkhalakarṣiṇaste / yeṣāṃ vibhānti taruṇāruṇarāgayogādbhinnādrigairikataṭā iva dantakośāḥ // Ragh(K)_5.72 //	Your elephants, with their sleep shaken off from both sides, are leaving their beds, pulling at their clanking chains: the elephants whose bud-like tusks seem as if they had pierced the red-mineral-skirts of a mountain, on account of their having come in contact with the rosy tints of the morning sun.
vaktroṣmaṇā malinayanti purogatāni lehyāni saindhavaśilāśakalāni vāhāḥ // Ragh(K)_5.73 // bhavati viralabhaktirmlānapuṣpopakāraḥ svakiraṇapariveśodbhedaśūnyāḥ pradīpāḥ /	O lotus-eyed one, the horses of the breed of the Vanâyu country (Persian horses), tied in spacious tents, having given up their sleep, are soiling with the warm breath (vapour) of their mouth the pieces of rock-salt placed before them for being licked. The flower-offering, being withered, has become loose in texture; the lamps are void of the throbbing circles (halo) of their light; and this your sweet-speaking parrot resting in its cage, imitates our speech employed to rouse you.
ayamapi ca giraṃ nastvatprabodhaprayuktāmanuvadati śukaste mañjuvākpañjarasthaḥ // Ragh(K)_5.74 // iti sa vihṛtanidrastalpamalpetarāṃsaḥ suragaja iva gāṅgaṃ saikataṃ supratīkaḥ /	The prince, his sleep dispelled by the young bards singing their songs in this strain, instantly left his bed, just as the heav- enly elephant, Supratîka, awakened from sleep by the royal swans cackling sweetly under excitement, leaves the sandy beach of the Ganges".
sa tatra mañceṣu vimānakalpeṣvākalpasammūrchitarūpaśobhān / siṃhāsanasthānnṛpatīnapaśyadyūpānprayastāniva haimavedīn // Ragh(K)_6.1 //	There he saw the protectors of the human world ( kings), seated on thrones placed on richly furnished platforms, and attired in fascinating dresses, (thereby) imitating the majesty of the gods moving in celestial cars.
ratergṛhītānunayena kāmaṃ pratyarpitasvāṅgamiveśvareṇa / kākutsthamālokayatāṃ nṛpāṇāṃ mano babhūvendumatīnirāśam // Ragh(K)_6.2 //	The mind of kings seeing Aja (lit. the scion of Kakutstha's race), who looked like Kâma with his corporeal frame restored to him by S'iva, at (lit. accepting) the entreaties of Rati, lost all hope of winning Indumatí.
vaidarbhanirdiṣṭamatho kumāraḥ klṝúptena sopānapathena mañcam / śilāvibhaṅgairmṛgarājaśāvastuṅgaṃ nagotsaṅgamivāruroha // Ragh(K)_6.3 //	The prince ascended the dais pointed out by the Vidarbha king, by means of a well-constructed flight of steps, as the young cub of the lord of beasts (lion) climbs the lofty peak of a mountain by means of (step-like) projecting rocks. Seated on a throne covered with tapestry of the richest colour and set with jewels, his majestic appearance was most comparable with Guha ( Kàrttikeya ) when riding his peacock.
tāsu śriyā rājaparamparāsu prabhāviśeṣodayadurnirīkṣyaḥ / sahasradhātmā vyarucadvibhaktaḥ payomucāṃ paṅktiṣu vidyuteva // Ragh(K)_6.5 //	Her own self, portioned out in a thousand ways into those rows of kings by Lakshmî, and dazzling to the eyes on account of the appearance of a peculiar effulgence, shone pre-eminently like the flash of lightning which distributes itself into so many rows of clouds.
teṣāṃ mahārhāsanasaṃśrayāṇāmudāttanepathyabhṛtāṃ sa madhye / rarāja dhāmnā raghusūnureva kalpadrumāṇāmiva pārijātaḥ // Ragh(K)_6.6 //	In the midst of those kings, all seated on magnificent thrones, and dressed in splendid costumes, the son of Raghu alone shone (looked pre-eminent) by his majestic lustre, like the tree Pârijáta in the midst of other heavenly trees.
madotkaṭe recitapuṣpavṛkṣā gandhadvipe vanya iva dvirephāḥ // Ragh(K)_6.7 //	The rows of the eyes of citizens leaving all (other) princes fell (rested) on him, just as the black bees vacating the flower- trees fall upon a wild scent-elephant, infuriated under the influence of ichor.
atha stute vandibhiranvayajñaiḥ somārkavaṃśye naradevaloke / sañcārite cāgurusārayonau dhūpe śikhāvāsitaketumāle // Ragh(K)_6.8 //	Now, while the whole assembly of monarchs, sprung from the solar and lunar races, was being glorified by bards acquainted with the pedigrees of kings, and the fume of the burnt pith of the fragrant aloe wood was ascending (curling up) to the flags on high, 9.
puropakaṇṭhopavanāśrayāṇāṃ śikhaṇḍināmuddhatanṛttahetau / pradhmātaśaṅkhe parito digantāṃstūryasvane mūrchati maṅgalārthe // Ragh(K)_6.9 //	while the sound of auspicious musical instruments swelled by the blasts of conch-shells was waxing loud and spreading all round in the quarters of heaven, making the peacocks roosting in the suburban gardens dance in a frantic manner, 10. the princess, who was about to elect her husband, and who had put on apparel suited to the nuptial rite, entered R.
manuṣyavāhyaṃ caturantayānamāsthāya kanyāparivāraśobhi /	T. 6( 44 ) [ Canto VI. the high road between the rows of platforms, seated in a quadrangular conveyance carried by men, and beautiful by her train of attendants.
nipeturantaḥkaraṇairnarendrā dehaiḥ sthitāḥ kevalamāsaneṣu // Ragh(K)_6.11 //	The kings fell down by their hearts on ( had their hearts at once drawn to) that supremely exquisite creation of the Creator, in the form of the damsel, the cynosure of hundreds of eyes; their bodies alone remained on their seats.
pravātaśobhā iva pādapānāṃ śṛṅgāraceṣṭā vividhā babhūvuḥ // Ragh(K)_6.12 //	Various were the amatory gestures, the first messengers of their love, exhibited by the kings who had betrayed their passion for her, as are the beautiful tender sprouts by trees.
kaścitkarābhyāmupagūḍhanālamālolapattrābhihatadvirepham / rajobhirantaḥpariveśaśobhi līlāravindaṃ bhramayāñcakāra // Ragh(K)_6.13 // visrastamaṃsādaparo vilāsī keyūrakoṭikṣaṇajātasaṅgam /	A certain king began to whirl round a sportive lotus, hold- ing its stock with both his hands, its restless petals striking black bees and its pollen forming a circle within it. Another gallant, with his handsome face obliquely turned round, drew up and put in its proper place the garland that had slipped from his shoulder and was sticking to the points of his armlet inlaid with gems.
ākuñcitāgrāṅgulinā tato 'nyaḥ kiñcitsamāvarjitanetraśobhaḥ / ratnāṃśusampṛktanakhaprabheṇa pādena haimaṃ vililekha pīṭham // Ragh(K)_6.15 //	A third again, with beautiful eyes slightly turned down- wards, drew lines on the gold foot-stool with his foot, the top-toes of which were a little contracted and the lustre of whose nails was spread obliquely.
vilāsinīvibhramadantapatramāpāṇḍuraṃ ketakabarhamanyaḥ / priyānitambocitasannipātairvipāṭayāmāsa yuvā nakhāgraiḥ // Ragh(K)_6.17 // kuśeśayātāmratalena kaścitkareṇa rekhādhvajalāñchanena /	One king, resting his left arm on a part of his seat, his shoulder being raised a little by that act, became intent upon talking to a friend, his pearl-necklace rolling over (or lying divided on) the lower part of his spine as it was slightly turned. Another young prince tore off, with the points of his nails, fit to be set on the hips of his beloved, a kelaka leaf, of a yellowish white colour, which serves as a sportive ear-ornament to coquet- tish women.
kaścidyathābhāgamavasthite 'pi svasanniveśavyatilaṅghinīva / vajrāṃśugarbhāṅgulirandhramekaṃ vyāpārayāmāsa karaṃ kirīṭe // Ragh(K)_6.19 //	Some one sportively cast up the dice, illumined with the glow of his jewelled ring, with his hand, the palm of which was as red as a lotus, and bore linear marks of banners. Some one put one of his hands, the lustre of the diamonds shooting through the finger chinks, on his crown, as if the latter had slipped from its proper place, although it was in its right position.
tato nṛpāṇāṃ śrutavṛttavaṃśā puṃvatpragalbhā pratihārarakṣī /	Then Sunandâ, the door-keeper of the harem, bold (clever in speech like a man, and well acquainted with the lives and pedi-Canto VI.
prāksannikarṣaṃ magadheśvarasya nītvā kumārīmavadatsunandā // Ragh(K)_6.20 //	] ( 45 ) grees of kings, took the princess, first of all, to the presence of the king of the Magadhas, and thus spoke- 21.
rājā prajārañjanalabdhavarṇaḥ parantapo nāma yathārthanāmā // Ragh(K)_6.21 // kāmaṃ nṛpāḥ santi sahasrasaṅkhyā rājanvatīmāhuranena pṛthvīm /	This is the king who rules over the Magadha land-the refuge of those who look up to him for protection, of spirit unfathomable, and renowned for governing his people well- Paramtapa by name, true to the sense. Granted that there are other kings by thousands; but the earth is said to have a pious ruler in him alone.
nakṣatratārāgrahasaṅkulāpi jyotiṣmatī candramasaiva rātriḥ // Ragh(K)_6.22 //	True that the night is crowded with constellations, stars and planets; but it is by reason of the moon alone that it has light (is illumined ).
kriyāprabandhādayamadhvarāṇāmajasramāhūtasahasranetraḥ / śacyāściraṃ pāṇḍukapolalambānmandāraśūnyānalakāṃścakāra // Ragh(K)_6.23 //	This king having to invite Indra (lit. the god with a thousand eyes) incessantly (to the earth), on account of the un- interrupted course of his sacrificial rites, caused (thereby) the tresses of s'achi to be long flowing about her pallid cheeks and undecked with the flowers of the Mandára tree.
anena cedicchasi gṛhyamāṇaṃ pāṇiṃ vareṇyena kuru praveśe / prāsādavātāyanasaṃśrayāṇāṃ netrotsavaṃ puṣpapurāṅganānām // Ragh(K)_6.24 //	If you wish that your hand should be accepted in marriage by this (prince), worthy to be chosen, then by accepting him) give delight to the eyes of the ladies of Pushpapura, as they will be looking at you, at the time of your entering the city, from the windows of the mansions.
evaṃ tayokte tamavekṣya kiñcidvisraṃsidūrvāṅkamadhūkamālā /	When she had said this, the thin princess looked at him, and without saying anything rejected him, with a cold salutation. while her garland of Madhûka flowers interspersed with dûrv û grass was slightly displaced.
ṛjupraṇāmakriyayaiva tanvī pratyādideśainamabhāṣamāṇā // Ragh(K)_6.25 // tāṃ sātha vetragrahaṇe niyuktā rājāntaraṃ rājasutāṃ nināya / samīraṇottheva taraṅgalekhā padmāntaraṃ mānasarājahaṃsīm // Ragh(K)_6.26 //	The very same maid, whose office it was to bear the cane staff, conducted the princess to a second king, just as a wave raised by the wind carries a female swan of the ma'nasa lake from one lotus to another; 27. and spoke to her-this is the lord of the Angas, whose youthful beauty had been coveted by (enamoured) the damsels of heaven, and who, having his elephants trained by the founders of the elephantine science, enjoys Indra's position though on earth. He, causing drops of tears as big as pearls to roll about on the bosoms of the wives of his enemies.
jagāda caināmayamaṅganāthaḥ surāṅganāprārthitayauvanaśrīḥ / vinītabhāgaḥ kila sūtrakārairaindraṃ padaṃ bhūmigato 'pi bhuṅkte // Ragh(K)_6.27 //	In his prison-house dwelt the lord of Lanká, the conqueror even of Indra, whose arms were rendered motionless by being bound with the bow-string, and whose row of mouths was gast- ing for breath, until the captor's pleasure (set him free). In his line is born this prince, Pratipa by name, who reverentially honours those versed in sacred lore, and by whom has been wiped off the reproach that S'ri is fickle by nature, a reproach which attaches to her name owing to the faults of those with whom she resides.
anena paryāsayatāśrubindūnmuktāphalasthūlatamānstaneṣu /	Do this youthful prince the honour of accepting him as your husband, O fair princess, and enjoy (the wealth, i.e., pleasures of) your youthful age, on a flower-bed, having tender leaves for its counterpane, in Vrindávana, not inferior to Chaitraratha (the garden of Kubera).
pratyarpitāḥ śatruvilāsinīnāmākṣepasūtreṇa vinaiva hārāḥ // Ragh(K)_6.28 //	He, with beautiful arms, and the foremost of archers, bears on his forearms two scars made by the bow-string, as if they are the two pathways, besprinkled with tears mixed with colly- rium of the Fortunes of his foes made captives by him.Canto VI.
nisargabhinnāspadamekasaṃstham asmindvayaṃ śrīśca sarasvatī ca /	His fame has gone up to the mountains, descended to the seas, entered the nether world, the dwelling-place of the serpents, and has found its way to heaven; thus spreading without cessation it is quite incapable of being exactly gauged.
kāntyā girā sūnṛtayā ca yogyā tvameva kalyāṇi tayostṛtīyā // Ragh(K)_6.29 //	Do you choose him who is your equal in birth, beauty and youth, and in those various virtues of which modesty is the chief; let the jewel be matched with gold.
athāṅgarājādavatārya cakṣuryāteti janyānavadatkumārī / nāsau na kāmyo na ca veda samyag draṣṭuṃ na sā bhinnarucirhi lokaḥ // Ragh(K)_6.30 //	Then at the conclusion of Sunandà's speech, the princess, lessening her bashfulness, accepted the prince, by casting at him a bright glance of joy, as if with the marriage-garland. Through her maidenly bashfulness the princess could not give expression to the love she felt for the young prince; but the love of that curly-haired damsel, piercing through her slender frame, manifested itself in the guise of her hair standing on end.
tataḥ paraṃ duṣprasahaṃ pareṣāṃ nṛpaṃ niyuktā pratihārabhūmau /	another;" thereupon the bride looked at her with a frown of dis- pleasure.
nidarśayāmāsa viśeṣakāntaminduṃ navotthānamivendumatyāḥ // Ragh(K)_6.31 //	Then the fair women of the city, setting aside all othe occupations in their eagerness to have a look at the bridegroom' acted in the following manner, in mansions having lattice-window of gold.
avantinātho 'yamudagrabāhurviśālavakṣāstanuvṛttamadhyaḥ /	He, dressed in silken garments, was led near the bride by the well-behaved keepers of the harem, as the (water of the) sea with its clear lines of foam is carried on to the shore by the new rays of the moon.
āropya cakrabhramamuṣṇatejāstvaṣṭreva yantrollikhito vibhāti // Ragh(K)_6.32 //	The lord of Kundina, having passed three nights on the way with Aja, renowned in the three worlds, turned back from him, as the moon recedes from the sun at the end of the conjunc- tion.
asya prayāṇeṣu samagraśakteragresarairvājibhiruddhatāni /	The two arrays of forces obtained from each other fluctu- ating defeat and victory; just like two waves of the mighty main, swelling up as a backward and forward gale blows alternately.
kurvanti sāmantaśikhāmaṇīṇāṃ prabhāprarohāstamayaṃ rajāṃsi // Ragh(K)_6.33 // asau mahākālaniketanasya candrārdhamaulernivasannadūre / divāpi jālāntaracandrikāṇāṃ nārīsakhaḥ sparśasukhāni bhuṅkte // Ragh(K)_6.34 //	That peerless warrior, seated in a chariot, with a quiver behind, clad in mail, holding a bow in his hand, and high-spirit- ed, repelled the foe; just as the great boar (Vishnu's incarnation) drove back the oceanic waters overflowing their bounds at the final destruction of the universe. When engaged in battle he was seen putting the right nor the left hand into (or, after Malli,-beautifully moving his right hand about) the mouth of the quiver; it seemed as if the bow. string of the warrior, once drawn to his ear, produced arrows that could kill his foes.
anena yūnā saha pārthivena rambhoru kaccinmanaso ruciste /	Now in the fight, all the kings with all efforts (or all.
siprātaraṅgānilakampitāsu vihartumudyānaparamparāsu // Ragh(K)_6.35 //	their might) attacked him with all the constituent parts of their armies, the war elephants being the chief among them, and us- ing all weapons, powerful enough to pierce through the coat of mail.
tasminnapi dyotanarūpabimbe pratāpasaṃśoṣitaśatrupaṅke /	His chariot being covered with volleys of missiles, he could be distinguished only by the top of his flagstaff, just as the forepart of the day, obscured by the mist, is known only by the faintly shining sun.
tāmagratastāmarasāntarābhām anūparājasya guṇairanūnām /	Then the army of the lords of men stood (including them - selves) overpowered by sleep, their hands not able to draw the bow, their helmets slipping disorderly on one shoulder and their bodies reclining against the flagstaffs.
vidhāya sṛṣṭiṃ lalitāṃ vidhātur jagāda bhūyaḥ sunasāṃ sunandā // Ragh(K)_6.37 //	fame, as it were, earned by the might of his arms. His own warriors, who now returned on recognising the sound of the conch (blown by Aja), saw him in the midst of his slumbering foes, like the shining image of the moon in the midst of closed lotuses.
