vāgarthāviva sampṛktau vāgarthapratipattaye / jagataḥ pitarau vande pārvatīparameśvarau // Ragh(K)_1.1 //	SFor the right comprehension of words and their senses, I salute Pârvati (the mountain's daughter) and Parames'vara (the supreme lord) the parents of the universe, who are (perpetually) united like words and their meanings.
kva sūryaprabhavo vaṃśaḥ kva cālpaviṣayā matiḥ / titīrṣurdustaraṃ mohāduḍupenāsmi sāgaram // Ragh(K)_1.2 //	The (exalted) race sprung from the sun, and my intellect of limited scope (to describe it),-how unequal the two! It is under a delusion that I am desirous of crossing, by means of a raft, the ocean, so difficult to be crossed.
prāṃśulabhye phale lobhādudbāhuriva vāmanaḥ // Ragh(K)_1.3 //	Dull (of intellect) and yet aspiring after a poet's fame, I shall expose myself to ridicule, like a dwarf, who, through greed, uplifts his hands for a fruit accessible (only) to the tall.
athavā kṛtavāgdvāre vaṃśe 'sminpūrvasūribhiḥ / maṇau vajrasamutkīrṇe sūtrasyevāsti me gatiḥ // Ragh(K)_1.4 //	Or rather, I shall find entrance into this race (I may enter upon the task of describing this line of kings), to which the door of description has already been opened by poets of yore, as does a thread into a gem previously perforated by a diamond-pin.
āsamudrakṣitīśānāmānākarathavartmanām // Ragh(K)_1.5 // yathāvidhihutāgnīnāṃ yathākāmārcitārthinām / yathāparādhadaṇḍānāṃ yathākālaprabodhinām // Ragh(K)_1.6 // tyāgāya sambhṛtārthānāṃ satyāya mitabhāṣiṇām / yaśase vijigīṣūṇāṃ prajāyai gṛhamedhinām // Ragh(K)_1.7 //	I, who am such, will describe the line of the Raghus, though my powers of expression are scanty, being impelled to this inconsiderate act by their (transcendental) virtues coming to my ears: the Raghus, who were pure from birth, who persevered in works until they bore fruit, who were lords of the earth bounded by the ocean, and the track of whose cars lay as far as the celestial regions (9, 5); who offered oblations to the holy fires in accord- ance with the prescribed rules, who honoured supplicants (by gifts) according to their desires, who inflicted punishment in proportion to the crime, and who (woke up, or) were on the alert at the proper time (6); who amassed wealth for giving it away in charity, who spoke sparingly for the sake of truthfulness, who were desirous of conquest for fame (alone), and who consorted with their wives solely for the sake of offspring (7); who (again) spent thei: boyhood in the study of letters, who enjoyed pleasures in their youth, who led an anchorite's life in their old age, and who finally resigned their bodies by means of yoga (i.e. fixing their min ds in meditation upon the supreme spirit).
taṃ santaḥ śrotumarhanti sadasadvyaktihetavaḥ / hemnaḥ saṃlakṣyate hyagnau viśuddhiḥ śyāmikāpi vā // Ragh(K)_1.10 //	It behoves the learned who alone can discriminate what is good from what is bad (lit. who are the causes of the distinction.; of (2) between good and bad) to listen to this (poem); for it is in fire alone that the purity or alloy of gold is tested.
vaivasvato manurnāma mānanīyo manīṣiṇām /	There was a king, by name Manu, the son of Vivasvat, esteemed by the wise, who was the first of kings, as the sacred syllble Om is of the Vedas.
tadanvaye śuddhimati prasūtaḥ śuddhimattaraḥ /	In this pure race was born a purer king, Dilipa by name, a supremely eminent monarch, just as the purer moon arose from the pure milky ocean.
vyūḍhorasko vṛṣaskandhaḥ sālaprāṃśurmahābhujaḥ / ātmakarmakṣamaṃ dehaṃ kṣātro dharma ivāśritaḥ // Ragh(K)_1.13 //	Broad-chested, stout-shouldered (lit. having shoulders like those of a bull), tall as the s'a'la tree, and massive-armed, he looked like the military virtue (heroism) appearing in a corporeal frame fitted for the discharge of its duties.
sthitaḥ sarvonnatenorvīṃ krāntvā merurivātmanā // Ragh(K)_1.14 //	Like the mountain Meru, he stood occupying (dominating) the whole earth, with a frame that exceeded all in strength, outshone all in lustre and transcended all in majesty.
ākārasadṛśaprajñaḥ prajñayā sadṛśāgamaḥ /	His intellect was commensurate with his bodily form, his knowledge with his intelligence, his undertakings with his knowledge, and his success with his undertakings.
bhīmakāntairnṛpaguṇaiḥ sa babhūvopajīvinām / adhṛṣyaścābhigamyaśca yādoratnairivārṇavaḥ // Ragh(K)_1.16 //	By his kingly virtues which were both awe-inspiring and amiable he was to his subjects, at once unapproachable and invit- ing, just as the ocean is on account of its monsters and gems.
rekhāmātramapi kṣuṇṇādātmano vartmanaḥ param / na vyatīyuḥ prajāstasya niyanturnemivṛttayaḥ // Ragh(K)_1.17 //	Acting like the rim of a wheel under a skilful driver, the subjects of him, their guide, swerved not even to the width of a line from the path that had been trodden from the days of Manu 18.
sahasraguṇamutsraṣṭumādatte hi rasaṃ raviḥ // Ragh(K)_1.18 //	He received taxes from his subjects only for the promotion of their welfare: for the sun sucks up water simply to give it back a thousand-fold (in the shape of rain).
senā paricchadastasya dvayamevārthasādhanam / śāstre ca vyāpṛtā buddhirmaurvī dhanuṣi cātatā // Ragh(K)_1.19 //	His army was but an appendage to him; his means of accomplishing his objects were only twofold-an intelligence that was unfoiled in (penetrated) the branches of learning, and the string stretched out on the bow.
phalānumeyāḥ prārambhāḥ saṃskārāḥ prāktanā iva // Ragh(K)_1.20 //	His counsels being secret and his countenance and designs inscrutable, his measures, like the impressions (left on the mind by the good or evil deeds) of a prior existence, were to be inferred only from their results.
jugopātmānamatrasto bheje dharmamanāturaḥ / agṛdhnurādade so 'rthānasaktaḥ sukhamanvabhūt // Ragh(K)_1.21 //	(Though) without fear, he protected his body; unafflicted with disease he performed religious rites; unavaricious he amassed wealth; and unaddicted he enjoyed pleasures.१०६ ( 3 ) 22.
jñāne maunaṃ kṣamā śaktau tyāge ślāghāviparyayaḥ / guṇā guṇānubandhitvāttasya saprasavā iva // Ragh(K)_1.22 //	His modest reserve, notwithstanding his knowledge; for- bearance, in spite of power; and absence of boasting, in the presence of beneficence; thus virtues, from their association in him with others (of opposite nature), were, as it were, like brothers born of the same womb (linked in a tie of brotherhood), 23.
anākṛṣṭasya viṣayairvidyānāṃ pāradṛśvanaḥ / tasya dharmaraterāsīdvṛddhatvaṃ jarasā vinā // Ragh(K)_1.23 //	He, who was not attracted by carnal pleasures, who had seen the very end of (mastered) the branches of knowledge, and who took delight in the discharge of his duty, had all the perfec- tion of old age without being (actually) aged.
sa pitā pitarastāsāṃ kevalaṃ janmahetavaḥ // Ragh(K)_1.24 //	By reason of his educating, Protecting, and maintaining his subjects, he was (virtually) their father; their (real) fathers were merely the source of their birth.
apyarthakāmau tasyāstāṃ dharma eva manīṣiṇaḥ // Ragh(K)_1.25 //	He punished criminals for the preservation of order, and had married only for progeny, so that, even his pursuit of wealth and sensual pleasures was simply the (pursuit of) Dharma (the performance of duty).
dudoha gāṃ sa yajñāya sasyāya maghavā divam / sampadvinimayenobhau dadhaturbhuvanadvayam // Ragh(K)_1.26 //	He drained (collected tributes from ) the earth for the performance of sacrifices, and Indra drained the heavens for (the growth of) crops; thus by an exchange of their wealth the two sustained the twin worlds.
na kilānuyayustasya rājāno rakṣituryaśaḥ /	Other kings, indeed, could not attain his fame for protect- ing people; for (the crime of) theft having turned away from men's property, survived only in the term (expressive of theft).
tyājyo duṣṭaḥ priyo 'pyāsīddaṣṭo 'ṅguṣṭha ivāhinā // Ragh(K)_1.28 //	A good man, though unfriendly, was acceptable to him, just as (though distasteful) medicine is to the sick; and even a friend, if wicked, was to be discarded, like a finger bitten by a cobra.
tathā hi sarve tasyāsanparārthaikaphalā guṇāḥ // Ragh(K)_1.29 //	Verily the Creator fashioned him with the ingredients of the five great elements; for all his qualities had solely the good of others (for their object).
sa velāvapravalayāṃ parikhīkṛtasāgarām / ananyaśāsanāmurvīṃ śaśāsaikapurīmiva // Ragh(K)_1.30 //	He governed the earth as if it were a single city, having the shores of the seas for its line of ramparts and the seas them- selves for its moats, and owning no other rule.
tasya dākṣiṇyarūḍhena nāmnā māgadhavaṃśajā / patnī sudakṣiṇetyāsīdadhvarasyeva dakṣiṇā // Ragh(K)_1.31 //	He had a wife, like Dakshinâ of Yajña, a princess of the royal line of the Magadhas, by name Sudakshinâ, a name grown out of her amiability (or generosity, benignity).
kalatravantamātmānamavarodhe mahatyapi /	He, the lord of the earth, though he had a large harem regarded himself as having a wife by her, a high-minded lady, and by the goddess of royal fortune.(4) 33.
tasyāmātmānurūpāyāmātmajanmasamutsukaḥ / vilambitaphalaiḥ kālaṃ sa nināya manorathaiḥ // Ragh(K)_1.33 //	(Ever) longing for the birth of a son from her, his worthy consort, he passed his days in hopes, the realization of which was long delayed.
īpsatā santatiṃ nyastā tena mantriṣu kosalā // Ragh(K)_1.34 // athābhyarcya vidhātāraṃ prayatau putrakāmyayā / tau dampatī vasiṣṭhasya gurorjagmaturāśramam // Ragh(K)_1.35 //	With a view to perform some religious rite that he might obtain a son, he took down from his arms the heavy yoke of the world (withdrew himself from the heavy task of governing the world) and entrusted it to his ministers. Then being purified, the two, husband and wife, worship- ped the Creator of the world with the desire of obtaining a son, and then started for the hermitage of Vasishtha, their spiritual guide.
snigdhagambhīranirghoṣamekaṃ syandanamāśritau / prāvṛṣeṇyaṃ payovāhaṃ vidyudairāvatāviva // Ragh(K)_1.36 //	They drove in a single chariot which made a deep but agreeable sound, and (therefore) looked like lightning and Airàvata riding a cloud of the rainy season.
mā bhūdāśramapīḍeti parimeyapuraḥsarau /	That there should be no disturbance to the hermritage, they took a limited retinue with them; but on account of their peculiar majesty they looked as if they were surrounded by an army.
sevyamānau sukhasparśaiḥ sālaniryāsagandhibhiḥ / puṣpareṇūtkirairvātairādhūtavanarājibhiḥ // Ragh(K)_1.38 //	They were fanned (as they passed on) by breezes of a pleasant touch, wafting the odour of the exudations of the S'a'la trees, scattering about the pollen of flowers, and gently shaking the rows of the forest trees.
manobhirāmāḥ śṛṇvantau rathanemisvanonmukhaiḥ / ṣaḍjasaṃvādinīḥ kekā dvidhā bhinnāḥ śikhaṇḍibhiḥ // Ragh(K)_1.42 //	They listened to the notes, delightful to the mind, of pea- cocks that raised their necks at (on hearing) the rumbling of the wheels of the chariot, notes of a double kind and corresponding (in pitch) to the Shadja air.
parasparākṣisādṛśyamadūrojjhitavartmasu / mṛgadvandveṣu paśyantau syandanābaddhadṛṣṭiṣu // Ragh(K)_1.43 //	They observed the similarity of each other's eyes in those of the couples of deer, that moved a little out of the way and had their eyes riveted on the gliding car. Occasionally they raised their beads (attracted) by the cranes uttering sweet notes, and forming, as it were, as they flew in a row, a gateway- garland unsupported by posts.
śreṇibandhādvitanvadbhirastambhāṃ toraṇasrajam /	On account of the favourableness of the wind betokening the fulfilment of their wish, the tresses of the queen and the turban of the king were not touched by the dust raised by the horses.
sārasaiḥ kalanirhrādaiḥ kvacidunnamitānanau // Ragh(K)_1.44 //	They smelt the highly-pleasing fragrance of the lotuses in the tanks, cool by its coming in close contact with the ripples and imitating (the fragrance of) their breath.
grāmeṣvātmanisṛṣṭeṣu yūpacihneṣu yajvanām / amoghāḥ pratigṛhṇantāvarghyānupadamāśiṣaḥ // Ragh(K)_1.45 //	In the villages granted by themselves and marked with the sacrificial posts, they accepted, after they had received the( 5 ) offerings of honour, the unfailing benedictions of the sacrificers (Bráhmaṇas who properly performed the sacrificial rites.) 45. They inquired of the aged cowherds, that came to them with fresh butter, the names of the wild trees by the road-side.
kāpyabhikhyā tayorāsīdvrajatoḥ śuddhaveśayoḥ / himanirmuktayoryoge citrācandramasoriva // Ragh(K)_1.46 //	As they journeyed on, clad in bright apparel, an indescriba- ble beauty was visible in them, like that in the conjunction of the constellation Chitra' with the moon, when freed from the mists of winter.
tattadbhūmipatiḥ patnyai darśayanpriyadarśanaḥ / api laṅghitamadhvānaṃ bubudhe na budhopamaḥ // Ragh(K)_1.47 //	Engaged in showing this thing and that thing (i.e. the various curiosities of the road) to his spouse, the lord of the earth, of amiable appearance and worthy to be compared with Budha, was not even aware of the whole distance travelled over.
sāyaṃ saṃyaminastasya maharṣermahiṣīsakhaḥ // Ragh(K)_1.48 //	He (the king,) of a fame unattainable (by any one eise) and having the queen for his companion, reached, at dusk, with his steeds fatigued, the hermitage of the mighty sage who always practised self-control.
āśvāsāya vihaṅgānāmālavālāmbupāyinām // Ragh(K)_1.50 // ātapāpāyasaṅkṣiptanīvārāsu niṣādibhiḥ / mṛgairvartitaromanthamuṭajāṅganabhūmiṣu // Ragh(K)_1.51 // ākīrṇamṛṣipatnīnāmuṭajadvārarodhibhiḥ / apatyairiva nīvārabhāgadheyocitairmṛgaiḥ // Ragh(K)_1.52 //	(The hermitage) which was (then) being filled by ancho- rites returning from other forests bringing with them sacrificial sticks, holy grass, and fruits, and welcomed back by the sacred fires advancing forward in an invisible form; 50.-which was being crowded with deer accustomed to receive a share of the niva'ra corn (wild rice) and blocking up the doors of the huts, as if they were the children of the wives of the hermits; 51.-wherein the saplings were quitted by the hermits' daughters immediately after the watering was over, in order to inspire confi- dence in the birds accustomed to drink water from the basins round the roots of the trees; 52.-where the antelopes were chewing the cud, squatting in the courtyards of the huts in which wild rice had been collected into heaps, at the decline of the evening sunshine.
abhyuddhṛtāgnipiśunairatithīnāśramonmukhān / punānaṃ pavanoddhūtairdhūmairāhutigandhibhiḥ // Ragh(K)_1.53 //	which was purifying the casual visitors coming towards it by the columns of smoke, indicating the blazing of fires, shaken up by the wind and charged with the odour of the offerings.
atha yantāramādiśya dhuryānviśramayeti saḥ / tāmavārohayatpatnīṃ rathādavaruroha ca // Ragh(K)_1.54 //	Then having ordered the charioteer to give rest to the horses, the king assisted his wife to alight from the car and him- self also got down.
tasmai sabhyāḥ sabhāryāya goptre guptatamendriyāḥ / arhaṇāmarhate cakrurmunayo nayacakṣuṣe // Ragh(K)_1.55 //	The hospitable saints, with their senses perfectly controlled, gave an honourable welcome to him, their worthy protector,(6) who was guided by the principles of justice, and to his roya! consort.
vidheḥ sāyantanasyānte sa dadarśa taponidhim / anvāsitamarundhatyā svāhayeva havirbhujam // Ragh(K)_1.56 //	When the evening rites were over, the King saw the treasure of penance (Vasishtha) with Arundhatî seated behind him, like the god of fire with the goddess Sva' ha' sitting behind.
tayorjagṛhatuḥ pādau rājā rājñī ca māgadhī / tau gururgurupatnī ca prītyā pratinanandatuḥ // Ragh(K)_1.57 //	The king and the queen, the princess of Magadha, seized (touched) their feet in adoration, and the spiritual guide and his wedded spouse greeted (blessed) them with affection in return.
ātitheyastamātithyavinītādhvapariśramam / papraccha kuśalaṃ rājye rājyāśramamuniṃ muniḥ // Ragh(K)_1.58 //	The sage asked him, who was a hermit in the hermitage of a kingdom, and whose fatigue cansed by the jolting of the car had been removed by the act of hospitality, whether all was right with his kingdom.
athātharvanidhestasya vijitāripuraḥ puraḥ / arthyāmarthapatirvācamādade vadatāṃ varaḥ // Ragh(K)_1.59 //	Then, before the sage, the repository of the Atharva-lore, he, the lord of wealth, who had conquered the cities of the enemies, and was foremost among eloquent men, began (entered upon) a speech full of sense.
upapannaṃ nanu śivaṃ saptasvaṅgeṣu yasya me /	"Proper, indeed, it is that welfare should reign in all the seven elements of my state, of whose God-sent and man-caused calamities you are the averter.
pratyādiśyanta iva me dṛṣṭalakṣyabhidaḥ śarāḥ // Ragh(K)_1.61 //	My arrows which can hit only a visible mark, are, as it were, rendered futile by the spells, which discomfit enemies from a distance (even before they are seen), of you the author of incanta- tions.
havirāvarjitaṃ hotastvayā vidhivadagniṣu / vṛṣṭībhavati sasyānāmavagrahaviśoṣiṇām // Ragh(K)_1.62 //	O sacrificer, the oblation duly offered by you to the holy fires turns itself into rain for nourishing the crops, which, else, would wither by drought.
puruṣāyuṣajīvinyo nirātaṅkā nirītayaḥ / yanmadīyāḥ prajāstatra hetustvadbrahmavarcasam // Ragh(K)_1.63 //	That my subjects live the full period of human life, that they are free from fears, and are never visited by public calamities, is all due to (the virtue of) your spiritual power.
tadevaṃ cintyamānasya guruṇā brahmayoninā / sānubandhāḥ kathaṃ na syuḥ sampado me nirāpadaḥ // Ragh(K)_1.64 //	When I am thus taken care of by you, my preceptor, the son of Brahman, and so am free from calamities, why should not my prosperity be uninterrupted ? 65.
kiṃ tu vadhvāṃ tavaitasyāmadṛṣṭasadṛśaprajam / na māmavati sadvīpā ratnasūrapi medinī // Ragh(K)_1.65 //	But, even the (sovereignty of the whole) earth, with all its islands, though the yielder of the precious products, does not please me, who have not seen a worthy offspring born of this your daughter-in-law.
matparaṃ durlabhaṃ matvā nūnamāvarjitaṃ mayā / payaḥ pūrve svaniḥśvāsakaduṣṇamupabhuñjate // Ragh(K)_1.66 //	Verily the libation of water, offered by me, is drunk, rendered lukewarm with their sighs, by my forefathers, thinking that it would be difficult to be obtained after my death.
so 'hamijyāviśuddhātmā prajālopanimīlitaḥ / prakāśaścāndhakāraśca lokāloka ivācalaḥ // Ragh(K)_1.67 //	I, therefore, with my soul purified by the performance of sacrifices, but obscured by want of issue, am both shining and not shining like the mountain Loka loka (which is lighted on one side and dark on the other).
lokāntarasukhaṃ puṇyaṃ tapodānasamudbhavam / santatiḥ śuddhavaṃśyā tu paratreha ca śarmaṇe // Ragh(K)_1.68 //	Religious merit, resulting from the performance of penance and acts of charity, produces happiness in the next world; but off- spring, of pure extraction, leads to bliss in the next, as also in this world.
tayā hīnaṃ vinetā māṃ kathaṃ paśyanna dūyate /	How is it, O mighty sage, that you are not grieved to see. me destitute of the same, like a sapling of the hermitage, watered personally through affection, bearing no fruit ? 71.
asahyapīḍaṃ bhagavannṛṇabandhamavaihi me / aruntudamivālānaṃ navabaddhasya dantinaḥ // Ragh(K)_1.70 //	Know then, O mighty one, that the last debt has been causing me unendurable pain, as the tie-post piercing the vitals, does to an elephant, deprived of the bath.
ikṣvākūṇāṃ durāpe 'rthe tvadadhīnā hi siddhayaḥ // Ragh(K)_1.71 //	It behoves you, O father, to do that by which I may be released from it; for when an object is difficult of attainment to the descendants of Ikshváku, the success depends upon you." 73.
iti vijñāpito rājñā dhyānastimitalocanaḥ / kṣaṇamātramṛṣistasthau suptamīna iva hradaḥ // Ragh(K)_1.72 //	Thus respectfully informed by the king, the saint remained for a moment, with his eyes fixed in meditation, like a tank, with its fish asleep.
bhāvitātmā bhuvo bharturathainaṃ pratyabodhayat // Ragh(K)_1.73 //	He whose soul was purified by ascetic exercises, discover- ed by meditation the cause of the stoppoge of issue to the lord of the earth and then informed him thus:- - 75.
purā śakramupasthāya tavorvīṃ pratiyāsyataḥ / āsītkalpatarucchāyāsevinī surabhiḥ pathi // Ragh(K)_1.74 //	"On a former occasion, when you were returning to the earth, having waited upon Indra, Surabhi (the divine cow) was reposing under the shade of a Kalpa-(desire-granting) tree on your way.
imāṃ devīmṛtusnātāṃ smṛtvā sapadi satvaraḥ / pradakṣiṇakriyātītastasyāḥ kopamajījanaḥ // Ragh(K)_1.75 //	Full of thoughts of this your queen, bathed after menstrua- tion, being afraid to violate a sacred obligation (to her), you did not act properly towards her who deserved the honour (lit. act) of circumambulation.
avajānāsi māṃ yasmādataste na bhaviṣyati /	(And) she cursed you thus :-'Since you have shown disrespect to me, no progeny shall be born to you unless you propitiate my daughter.' 78.
sa śāpo na tvayā rājanna ca sārathinā śrutaḥ / nadatyākāśagaṅgāyāḥ srotasyuddāmadiggaje // Ragh(K)_1.77 //	Neither by you, nor by your charioteer, was the impreca- tion heard (being pronounced), as the stream of the Celestia!(8) Ganges was then in tumultuous uproar on account of the elephants of the quarters sporting wantonly in it.
pratibadhnāti hi śreyaḥ pūjyapūjāvyatikramaḥ // Ragh(K)_1.78 //	Know, then, that the attainment of your desire is barred by (that disrespect towards the cow); for omisssion of honour to those worthy of honour obstructs one's welfare.
haviṣe dīrghasattrasya sā cedānīṃ pracetasaḥ / bhujaṅgapihitadvāraṃ pātālamadhitiṣṭhati // Ragh(K)_1.79 //	That heavenly cow, however, is at present dwelling in the nether regions, the gates of which are blocked up (guarded) by serpents, for the supply of oblations in the prolonged sacrificial session which Varuna has instituted.
sa tvamekāntarāṃ tasyā madīyāṃ vatsamātaram / ārādhaya sapatnīkaḥ sā vāṃ kāmaṃ pradāsyati // Ragh(K)_1.80 //	Do you then take the daughter of Surabhi as her representative, and with your wife, propitiate her in a state of purity; for she, when pleased, is a milker of (gratifies) desires." 82.
iti vādina evāsya hoturāhutisādhanam / anindyā nandinī nāma dhenurāvavṛte vanāt // Ragh(K)_1.81 //	Just as he was speaking thus there came back from the forest the cow, Nandinf by name, blameless and the source (provider) of oblations to that habitual sacrificer.
sandhyā prātipadeneva vyatibhinnā himāṃśunā // Ragh(K)_1.82 // bhuvaṃ koṣṇena kuṇḍodhnī medhyenāvabhṛthādapi /	Of a soft pink colour, like a (new) leaf, and bearing a slightly-curved mark of white hair ( appearing on her forehead ), just as the evening-sky (pale-red like the young shoot), bears the crescent of the new moon.
prasnavenābhivarṣantī vatsālokapravartinā // Ragh(K)_1.83 // rajaḥkaṇaiḥ khuroddhūtaiḥ spṛśadbhirgātramantikāt / tīrthābhiṣekajāṃ śuddhimādadhānā mahīkṣitaḥ // Ragh(K)_1.84 //	With a large udder, and drenching the earth with a stream of tepid milk, which flowed at the sight of her calf and which was more sanctifying than even the ablution performed at the conclusion of a sacrifice. Imparting to the king the sanctity that arises from ablutions in a holy stream, by means of the particles of dust raised by her hoofs and coming from near in contact with his body.
tāṃ puṇyadarśanāṃ dṛṣṭvā nimittajñastapodhanaḥ / yājyamāśaṃsitāvandhyaprārthanaṃ punarabravīt // Ragh(K)_1.85 //	Seeing her of holy appearance, the receptacle of ascetism (the sage), versed in reading omens, again addressed him (the king), whose officiating priest he was, and whose desire to gain his object was not to be barren (was sure to be fulfilled ).
adūravartinīṃ siddhiṃ rājanvigaṇayātmanaḥ / upasthiteyaṃ kalyāṇī nāmni kīrtita eva yat // Ragh(K)_1.86 //	"Know for certain, O king, that the fulfilment of your wish is not far distant, since this blessed one has turned up the very moment her name was mentioned.
vanyavṛttirimāṃ śaśvadātmānugamanena gām / vidyāmabhyasaneneva prasādayitumarhasi // Ragh(K)_1.87 //	It behoves you therefore) to propitiate this cow by unceasing attendance upon her, and living npon the products of the forest, just as one does (gains) knowledge by close application.
prasthitāyāṃ pratiṣṭhethāḥ sthitāyāṃ sthānamācareḥ /	You should move on when she moves on, stand when she stands, sit down when she does so, and drink water when she has done the same.(9) 90.
